<?xml version="1.0" encoding="utf-8"?>
<?xml-stylesheet href="estilo.css"?>
<Examen xmlns:xsi="http/www.w3.org/2001/XMLSchema-instance" xsi:noNamespaceSchemaLocation="xsd.xsd">


    <Aspirantes>
        <Id_Aspirantes> </Id_Aspirantes>
        <Nombres></Nombres>
        <Apellidos></Apellidos>
        <DNI></DNI>
        <Teléfono></Teléfono>
        <Direccion></Direccion>
        <Fecha_nacimiento></Fecha_nacimiento>
        <Dan></Dan>
        <Cinturon></Cinturon>
        <Fecha_Ingreso></Fecha_Ingreso>
        <Foto_Aspirante></Foto_Aspirante>
        <Tiempo_Dan_Anterior></Tiempo_Dan_Anterior>
        <FotoDNI></FotoDNI>
        <FotoCarnetGrados></FotoCarnetGrados>
    </Aspirantes>




    <Meritos>
        <Id_Aspirantes></Id_Aspirantes>
        <Edad_aspirante></Edad_aspirante>
        <LicenciaActualizada></LicenciaActualizada>
        <TrabajoEscrito></TrabajoEscrito>
    </Meritos>



    <Convalidacion_grados>
        <Id_Aspirantes></Id_Aspirantes>
    </Convalidacion_grados>



    <Requisitos_aspirante>
        <SolicitudhHasta3Dan></SolicitudhHasta3Dan>
        <DanySuperiorCurriculum4></DanySuperiorCurriculum4>
    </Requisitos_aspirante>



    <Dispensa_medica>
        <Id_Aspirante></Id_Aspirante>
    </Dispensa_medica>


    <Jueces>
        <Id_Jueces></Id_Jueces>
        <Nombres></Nombres>
        <Apellidos></Apellidos>
        <DiplomaJuez></DiplomaJuez>
    </Jueces>

    

    <Criterio_valoracion>
        <Indumentaria></Indumentaria>
        <AseoPersonal></AseoPersonal>
        <EjecuciónTecnica></EjecuciónTecnica>
        <Valores></Valores>
        <Respuestas></Respuestas>
    </Criterio_valoracion>



    <Tribunal>
        <Numero_Jueces></Numero_Jueces>
        <Calificacion_final></Calificacion_final>
    </Tribunal>



    <Abonar_cuota>
        <Id_Aspirante></Id_Aspirante>
    </Abonar_cuota>



    <Suspender_examen>
        <Id_Aspirante></Id_Aspirante>
        <SuspenderParcial></SuspenderParcial>
        <SuspenderTotal></SuspenderTotal>
        <SuspenderSegundaFase></SuspenderSegundaFase>
    </Suspender_examen>



    <Quintodanysuperior>
        <Kata></Kata>
        <Coloquio></Coloquio>
    </Quintodanysuperior>



    <Hasta3erdan>
        <Tecnicas></Tecnicas>
        <Kata></Kata>
        <Kumite></Kumite>
        <Campeonatos></Campeonatos>
    </Hasta3erdan>



    <Cinturonnegro>
        <Tecnica_Directa></Tecnica_Directa>
        <Tecnica_Circulares></Tecnica_Circulares>
        <Tecnica_Pierna></Tecnica_Pierna>
        <Teoria></Teoria>
        <Kata></Kata>
        <Kumite></Kumite>
    </Cinturonnegro>



    <Cinturonnegroprimerdan>
        <Tecnica_Defensa></Tecnica_Defensa>
        <Tecnica_Pierna></Tecnica_Pierna>
        <Tecnica_DirectaIndirecta></Tecnica_DirectaIndirecta>
        <Tecnica_Combinada></Tecnica_Combinada>
        <Teoria></Teoria>
        <Kata></Kata>
        <Kumite></Kumite>
        <Aplicacion_Tecnica></Aplicacion_Tecnica>
    </Cinturonnegroprimerdan>



    <Cinturonnegrosegundodan>
        <Tecnica_Base></Tecnica_Base>
        <Tecnica_Directa></Tecnica_Directa>
        <Tecnica_IndirectaCircular></Tecnica_IndirectaCircular>
        <Tecnica_Pierna></Tecnica_Pierna>
        <Tecnica_Combinada></Tecnica_Combinada>
        <Teoria></Teoria>
        <Kata></Kata>
        <Kumite></Kumite>
        <Campeonatos></Campeonatos>
        <Tecnicas></Tecnicas>
        <Aplicacion_Tecnica></Aplicacion_Tecnica>
        <Demo_Libre></Demo_Libre>
    </Cinturonnegrosegundodan>



    <Cinturonnegrotercerdan>
        <Variaciones_Tecnica></Variaciones_Tecnica>
        <Kumite></Kumite>
        <Kata></Kata>
        <Aplicacion_Tecnica></Aplicacion_Tecnica>
        <Teoria></Teoria>
        <Kumite></Kumite>
        <Campeonatos></Campeonatos>
        <Tecnica></Tecnica>
        <Aplicaciones></Aplicaciones>
        <Aplicacion_Tecnica></Aplicacion_Tecnica>
        <Demo_Libre></Demo_Libre>
    </Cinturonnegrotercerdan>



    <Cinturonnegrocuartodan>
        <Kumite></Kumite>
        <Kata></Kata>
        <Aplicacion_Tecnica></Aplicacion_Tecnica>
        <Teoria></Teoria>
        <Demo_Libre></Demo_Libre>
    </Cinturonnegrocuartodan>



    <Resultados>
        <Id_Aspirante></Id_Aspirante>
    </Resultados>

</Examen>
